"topic,theme,question"
finance,Debt Management,"What are the best strategies for managing multiple types of debt simultaneously, like student loans and credit card debt?"
finance,Debt Management,How do you decide whether to pay off debt or invest when both seem important?
finance,Debt Management,"What impact does high credit card utilization have on your credit score, and how can you manage it effectively?"
finance,Debt Management,Is it better to consolidate debt into one loan or tackle each debt individually?
finance,Debt Management,How do you handle unexpected medical debt when it throws off your financial plans?
finance,Debt Management,What are some psychological tips for staying motivated while paying off large amounts of debt?
finance,Debt Management,What should someone do if they're drowning in debt but can't find a job that pays enough to cover minimum payments?
finance,Debt Management,How can someone decide whether to use savings to pay off debt or keep it for emergencies?
finance,Debt Management,Is it better to focus on paying off high-interest loans first or to pay down smaller debts to feel some progress?
finance,Debt Management,What are the options for someone who can't make their student loan payments and is worried about defaulting?
finance,Debt Management,How should someone handle debt collectors if they're being sued for unpaid credit card debt?
finance,Debt Management,What's the best way to manage debt when unexpected expenses keep popping up and there's no family support?
finance,Debt Management,Can your house really be taken away if you don't pay your credit card bills?
finance,Debt Management,Should you pay off debt first or save for a down payment if you want to buy a house soon?
finance,Debt Management,Is it better to use a windfall of cash to pay off debt or should you keep it as savings for emergencies?
finance,Debt Management,How do you decide between paying off high-interest debt or saving for retirement when money is tight?
finance,Debt Management,What's the best way to handle debt if you're worried about losing your job soon?
finance,Debt Management,How do you know if filing for bankruptcy is the right choice when you can't keep up with payments?
finance,Home Ownership & Major Purchases,"Is it financially smarter to rent or buy a home in today's market, considering long-term investments?"
finance,Home Ownership & Major Purchases,What are the key factors to consider when choosing between a conventional loan and an FHA loan for a home purchase?
finance,Home Ownership & Major Purchases,How can first-time homebuyers overcome anxiety and uncertainty during the home buying process?
finance,Home Ownership & Major Purchases,"What should you do if a home inspection report reveals significant issues, but your real estate agent downplays them?"
finance,Home Ownership & Major Purchases,Is it advisable to use investment accounts like a Roth IRA as a savings strategy for a future home down payment?
finance,Home Ownership & Major Purchases,How do people manage to afford a home in high-cost living areas without compromising their financial stability?
finance,Home Ownership & Major Purchases,Is it better to buy a house now or keep renting if I'm worried about job security?
finance,Home Ownership & Major Purchases,Should I use my savings to buy a bigger house or invest in renovating my current one?
finance,Home Ownership & Major Purchases,Is it a good idea to sell my home and invest the money in the stock market instead?
finance,Home Ownership & Major Purchases,How do I decide whether to buy a home or keep renting when I'm expecting a baby soon?
finance,Home Ownership & Major Purchases,What's the best way to save for a down payment if I'm worried about market fluctuations?
finance,Home Ownership & Major Purchases,Is it smarter to buy a home with my partner or keep renting until we're more financially stable?
finance,Home Ownership & Major Purchases,How much should I have saved up before even thinking about buying a house?
finance,Home Ownership & Major Purchases,Is it better to buy a smaller house now or wait and save for a bigger one?
finance,Home Ownership & Major Purchases,What's the smartest way to decide between buying a house or continuing to rent?
finance,Home Ownership & Major Purchases,How do I know if a house is too expensive for me to afford?
finance,Home Ownership & Major Purchases,Should I focus on saving for a house or put more into my retirement fund?
finance,Home Ownership & Major Purchases,What should I do if I can't afford my mortgage anymore?
finance,Savings Strategy,What are some effective ways to stick to a strict monthly budget without feeling deprived?
finance,Savings Strategy,How do you balance saving for retirement with the possibility of not living to see it?
finance,Savings Strategy,What's the best type of account to use when saving for a child's future education?
finance,Savings Strategy,How do you decide when you have too much in your emergency fund versus investing it elsewhere?
finance,Savings Strategy,Is it ever a good idea to pause retirement contributions to build up an emergency fund?
finance,Savings Strategy,How do you apply the 50/30/20 rule when your income varies from week to week?
finance,Savings Strategy,How do I decide between saving for retirement and keeping money available for emergencies?
finance,Savings Strategy,What's the best way to start saving when living paycheck to paycheck?
finance,Savings Strategy,How should I balance saving for a house and putting money away for retirement?
finance,Savings Strategy,"If I have a little extra money each month, should I save it or pay down debts first?"
finance,Savings Strategy,What's a good way to save for the future if I don't think I'll live past 60?
finance,Savings Strategy,How can I start saving if I've never been taught how to manage money?
finance,Savings Strategy,How do I start saving money if I'm living paycheck to paycheck and feeling stuck?
finance,Savings Strategy,What should I do with extra money each month if I want to make sure my kids have a better financial future?
finance,Savings Strategy,"If I'm worried about not having enough for emergencies, how much should I actually try to save?"
finance,Savings Strategy,Is it better to save for a house down payment or pay off my car loan first?
finance,Savings Strategy,How can I start saving for retirement if I'm not sure social security will be there for me?
finance,Savings Strategy,"What's the best way to save money for a big goal, like a house or a new car, when I don't know where to start?"
finance,Small Investments,What's the best way to start investing with just $500?
finance,Small Investments,Are there any low-cost investment options that offer decent returns for beginners?
finance,Small Investments,How do you decide whether to reinvest profits or cash out when dealing with small investments?
finance,Small Investments,Is it smarter to invest a small windfall all at once or spread it out over time?
finance,Small Investments,What are some common mistakes people make when starting with small investments?
finance,Small Investments,How can someone with a tight budget begin building an investment portfolio?
finance,Small Investments,"If you suddenly come into a large amount of money, how do you decide whether to invest it or pay off existing debt?"
finance,Small Investments,How do you figure out the best way to invest a small amount of money if you're worried about losing it all?
finance,Small Investments,"Is it a good idea to use emergency savings to invest, or should that money always be kept separate?"
finance,Small Investments,What's a safe way to start investing if you have no experience and are afraid of making a mistake?
finance,Small Investments,How should you decide between saving for a house or investing in the stock market when both seem important?
finance,Small Investments,What should you do with a small inheritance if you're not sure whether to invest it or save it for future expenses?
finance,Small Investments,What's the safest way to start investing a small amount of money if you have no prior experience?
finance,Small Investments,"How can you invest a small windfall without risking it all, especially if you're new to investing?"
finance,Small Investments,Where should you keep emergency savings to make a little extra money without taking big risks?
finance,Small Investments,Is it better to invest in stocks or keep savings in a bank if you're worried about losing money?
finance,Small Investments,How can someone with no finance background start learning about investing without feeling overwhelmed?
finance,Small Investments,What's the best way to invest a small amount of money for someone who might need it back soon?
health,Diet & Weight Management,What should someone do if they want to lose weight but can't afford a gym membership or expensive diet plans?
health,Diet & Weight Management,How can a busy working parent manage to eat healthy when they have little time to cook?
health,Diet & Weight Management,"Is it safe to try to lose a lot of weight quickly for a special event, and if not, what are the risks?"
health,Diet & Weight Management,What are some affordable ways to maintain a healthy diet on a tight budget?
health,Diet & Weight Management,How can someone with a history of eating disorders approach weight loss safely?
health,Diet & Weight Management,What's the best way for someone with a sedentary job to stay active and manage their weight?
health,Diet & Weight Management,How can someone manage their weight if they have a medical condition that affects their metabolism?
health,Diet & Weight Management,What are some strategies for reducing sugar intake without feeling deprived?
health,Diet & Weight Management,How can someone balance the need to lose weight with the stress of a demanding job?
health,Diet & Weight Management,What should someone consider when trying to quit sugar if they rely on it for energy?
health,Diet & Weight Management,How can someone who feels constantly hungry manage their appetite while trying to lose weight?
health,Diet & Weight Management,"Is it possible to lose weight and gain muscle at the same time, and if so, how should one go about it?"
health,Major Family Health & Caregiving Decisions,How do you decide when it's time to stop a loved one from driving for their safety?
health,Major Family Health & Caregiving Decisions,What should you do if a family member refuses to see a doctor despite showing signs of serious illness?
health,Major Family Health & Caregiving Decisions,How do you handle the guilt of wanting to take a break from caregiving for a family member?
health,Major Family Health & Caregiving Decisions,What's the best way to talk to siblings about sharing caregiving responsibilities?
health,Major Family Health & Caregiving Decisions,How do you know when it's time to move a parent into assisted living?
health,Major Family Health & Caregiving Decisions,What can you do if an elderly family member insists on living alone but clearly needs help?
health,Major Family Health & Caregiving Decisions,How do you balance caring for a sick family member with your own mental health needs?
health,Major Family Health & Caregiving Decisions,What are the signs that a family member might need professional caregiving instead of family support?
health,Major Family Health & Caregiving Decisions,How do you approach a family member about their declining health when they are in denial?
health,Major Family Health & Caregiving Decisions,What's the best way to prepare financially for taking care of an aging parent?
health,Major Family Health & Caregiving Decisions,How do you manage family disagreements about the best care plan for an elderly relative?
health,Major Family Health & Caregiving Decisions,What should you consider before quitting your job to take care of a family member full-time?
health,Managing Substance Use or High-Risk Habits,How do I know if my drinking is becoming a problem if it feels normal to me?
health,Managing Substance Use or High-Risk Habits,Is it possible to gamble responsibly if I've already lost a lot of money?
health,Managing Substance Use or High-Risk Habits,What should I do when I feel like I'm about to relapse into drinking after being sober for a while?
health,Managing Substance Use or High-Risk Habits,How can I tell if my partner's drinking habits are unhealthy or just different from mine?
health,Managing Substance Use or High-Risk Habits,Are there any safe ways to cut back on alcohol without going cold turkey?
health,Managing Substance Use or High-Risk Habits,How do I support a friend who keeps going back to gambling even though they want to quit?
health,Managing Substance Use or High-Risk Habits,What are some healthy ways to cope with stress instead of turning to alcohol or drugs?
health,Managing Substance Use or High-Risk Habits,Can taking certain vitamins really help protect my body from the effects of drinking?
health,Managing Substance Use or High-Risk Habits,When is it time to seek professional help for a gambling problem?
health,Managing Substance Use or High-Risk Habits,How can I help someone who keeps apologizing for their drinking but doesn't seem to change?
health,Managing Substance Use or High-Risk Habits,What should I do if I feel guilty for gambling but can't seem to stop?
health,Managing Substance Use or High-Risk Habits,How do I know if I'm drinking too little water and it's affecting my health?
health,Mental Health & Stress Management,How can I manage overwhelming stress from work when quitting isn't an option?
health,Mental Health & Stress Management,What should I do if my medication for anxiety is making me feel worse?
health,Mental Health & Stress Management,How do you deal with the pressure of feeling like you're not achieving enough in life?
health,Mental Health & Stress Management,What's the best way to handle a situation where your boss is making you feel worthless?
health,Mental Health & Stress Management,How can I stop feeling guilty about not wanting to have kids when everyone expects me to?
health,Mental Health & Stress Management,What's a good approach to dealing with burnout when you can't afford to take time off?
health,Mental Health & Stress Management,How do you talk to your parents about mental health issues when they don't believe in them?
health,Mental Health & Stress Management,What's a safe way to handle severe anxiety when you're afraid to see a doctor?
health,Mental Health & Stress Management,How can I cope with the fear of making a big life change when I'm already stressed?
health,Mental Health & Stress Management,What's the best way to deal with feeling isolated and anxious in college?
health,Mental Health & Stress Management,How can I manage my mental health when I feel trapped in a toxic family environment?
health,Mental Health & Stress Management,What's a practical approach to improving mental health through diet without breaking the bank?
career,Handling Identity-Based Workplace Conflict,How can you handle being treated unfairly at work because of your gender or identity?
career,Handling Identity-Based Workplace Conflict,What's the best way to deal with a boss who seems to discriminate against you for personal reasons?
career,Handling Identity-Based Workplace Conflict,"If you suspect you're being paid less because of your identity, what should you do?"
career,Handling Identity-Based Workplace Conflict,What steps can you take if you feel like you're being bullied at work because of who you are?
career,Handling Identity-Based Workplace Conflict,How can you confront a coworker who makes you feel uncomfortable due to your identity?
career,Handling Identity-Based Workplace Conflict,What should you do if you think you were fired because of your gender or identity?
career,Handling Identity-Based Workplace Conflict,How do you handle a situation where your workplace ignores your requests for reasonable accommodations?
career,Handling Identity-Based Workplace Conflict,What's the best way to document discrimination at work to protect yourself?
career,Handling Identity-Based Workplace Conflict,How do you approach HR if you feel your identity is affecting your job security?
career,Handling Identity-Based Workplace Conflict,What should you do if you're being overworked because of someone else's discrimination-related firing?
career,Handling Identity-Based Workplace Conflict,How can you advocate for yourself if you believe your age is affecting how you're treated at work?
career,Handling Identity-Based Workplace Conflict,What's the safest way to address a situation where you feel your identity is being used against you in performance reviews?
career,Major Career Planning & Shifts,How do you decide if it's worth going back to school for a new degree when you're already in a stable job?
career,Major Career Planning & Shifts,What should someone consider before quitting a job they hate without another one lined up?
career,Major Career Planning & Shifts,How can you tell if a career coach is actually worth the money?
career,Major Career Planning & Shifts,Is it smart to take a job offer with a big pay increase but less job security?
career,Major Career Planning & Shifts,What are the risks of starting a business with no savings or financial backup?
career,Major Career Planning & Shifts,How do you know if you're too old to switch careers and start from scratch?
career,Major Career Planning & Shifts,What should you do if you're stuck in a job that doesn't pay enough to cover your basic living expenses?
career,Major Career Planning & Shifts,How do you decide between staying in a comfortable job or chasing a dream job that might not pay well?
career,Major Career Planning & Shifts,What are the potential downsides of moving to a new country for a job?
career,Major Career Planning & Shifts,How should you prioritize paying off debt when you're unemployed?
career,Major Career Planning & Shifts,When is it a good idea to turn down a job that pays more but requires relocating?
career,Major Career Planning & Shifts,What are the potential consequences of quitting a job to start a side hustle full-time?
career,Navigating Systemic Burnout & a Toxic Work Environment,How do you decide if it's worth staying at a job that pays well but makes you miserable?
career,Navigating Systemic Burnout & a Toxic Work Environment,What should you do if your job is causing you severe stress but you can't afford to quit?
career,Navigating Systemic Burnout & a Toxic Work Environment,How can you tell if you're experiencing burnout or just a temporary rough patch at work?
career,Navigating Systemic Burnout & a Toxic Work Environment,What are some ways to cope with a toxic boss when quitting isn't an option right now?
career,Navigating Systemic Burnout & a Toxic Work Environment,How do you know if it's time to leave a job that's impacting your mental health?
career,Navigating Systemic Burnout & a Toxic Work Environment,Is it better to leave a toxic job without another lined up or stick it out until you find something else?
career,Navigating Systemic Burnout & a Toxic Work Environment,What steps can you take if you're feeling trapped in a job that's ruining your confidence?
career,Navigating Systemic Burnout & a Toxic Work Environment,How do you manage the fear of financial instability when considering leaving a toxic workplace?
career,Navigating Systemic Burnout & a Toxic Work Environment,What should you do if you're worried about being fired but need the job to pay your bills?
career,Navigating Systemic Burnout & a Toxic Work Environment,How do you handle a work environment that feels toxic without burning bridges?
career,Navigating Systemic Burnout & a Toxic Work Environment,What's the best way to approach a job search when you're burnt out and overwhelmed?
career,Navigating Systemic Burnout & a Toxic Work Environment,How can you rebuild your self-esteem after leaving a job that made you doubt your abilities?
career,Negotiation & Promotion,How do you handle being passed over for a promotion when you feel you deserved it?
career,Negotiation & Promotion,Is it worth negotiating a job offer if you're worried they might take it back?
career,Negotiation & Promotion,What should you do if your boss suddenly offers you a promotion after you decide to quit?
career,Negotiation & Promotion,How can you ask for a raise without risking your job?
career,Negotiation & Promotion,Is it a good idea to accept a lower salary for better retirement benefits?
career,Negotiation & Promotion,What should you do if a family member tricks you out of your share in a business?
career,Negotiation & Promotion,How do you decide whether to stay at a job you love but where you keep getting passed over for promotions?
career,Negotiation & Promotion,Is it better to negotiate salary upfront or wait until you have more leverage?
career,Negotiation & Promotion,How do you approach a coworker who is upset because you got promoted over them?
career,Negotiation & Promotion,Should you ever accept a job offer without negotiating if you really need the job?
career,Negotiation & Promotion,How do you respond if your company hires someone else for a promotion you thought was yours?
career,Negotiation & Promotion,Is it too risky to ask for a significant salary increase when switching from a secure job?
